{
  "artifact_id": "V.BUILD_PIPELINE",
  "run_id": "build_pipeline",
  "score": 8,
  "strength_level": "certifying",
  "positive_factors": [
    "executes_target_artifact",
    "has_assertions",
    "multiple_assertions",
    "p2_or_p3_authority",
    "independent_authority"
  ],
  "penalties": [
    "post_solution_test"
  ],
  "smell_flags_used": [
    "post_solution_test"
  ]
}