{
  "artifact_id": "F.E2E_FINAL",
  "run_id": "e2e_final",
  "score": 6,
  "strength_level": "gating",
  "positive_factors": [
    "executes_target_artifact",
    "has_assertions",
    "multiple_assertions",
    "p2_or_p3_authority"
  ],
  "penalties": [
    "post_solution_test"
  ],
  "smell_flags_used": [
    "post_solution_test"
  ]
}